{
  "$schema": "https://json-schema.org/draft/2020-12/schema",
  "$id": "urn:joedesk:results:v2",
  "type": "object",
  "additionalProperties": false,
  "required": [
    "schema",
    "seq",
    "generatedAt",
    "currency",
    "timeZone",
    "trackingStart",
    "days",
    "trades",
    "benchmark"
  ],
  "properties": {
    "schema": {
      "const": "inspr.joe.household.results.v2",
      "x-owner": "paper executor 8470"
    },
    "seq": {
      "type": "integer",
      "minimum": 1,
      "maximum": 9007199254740991,
      "x-owner": "paper executor 8470"
    },
    "generatedAt": {
      "$ref": "urn:joedesk:common:v2#/$defs/instant",
      "x-owner": "paper executor 8470"
    },
    "receivedAt": {
      "$ref": "urn:joedesk:common:v2#/$defs/instant",
      "x-owner": "server"
    },
    "missingDays": {
      "type": "array",
      "maxItems": 100000,
      "items": { "$ref": "urn:joedesk:common:v2#/$defs/date" },
      "description": "Server-owned sorted unique past Vienna dates with closed trades but no days[] entry, computed at acceptance. Omitted when empty.",
      "x-owner": "server"
    },
    "currency": {
      "const": "EUR",
      "x-owner": "paper executor 8470"
    },
    "timeZone": {
      "const": "Europe/Vienna",
      "x-owner": "paper executor 8470"
    },
    "trackingStart": {
      "$ref": "urn:joedesk:common:v2#/$defs/date",
      "x-owner": "paper executor 8470"
    },
    "days": {
      "type": "array",
      "items": {
        "type": "object",
        "additionalProperties": false,
        "required": [
          "date",
          "desks"
        ],
        "properties": {
          "date": {
            "$ref": "urn:joedesk:common:v2#/$defs/date",
            "x-owner": "paper executor 8470"
          },
          "coverage": {
            "type": "string",
            "enum": ["full", "partial"],
            "description": "Defaults to full when omitted. Partial means trades[] covers only part of this Vienna day; skip day/trade reconciliation.",
            "x-owner": "paper executor 8470"
          },
          "desks": {
            "type": "object",
            "additionalProperties": false,
            "required": [],
            "properties": {
              "j": {
                "type": "object",
                "additionalProperties": false,
                "required": [
                  "equityClose",
                  "realisedNet",
                  "fees",
                  "trades"
                ],
                "properties": {
                  "equityClose": {
                    "anyOf": [
                      {
                        "$ref": "urn:joedesk:common:v2#/$defs/money"
                      },
                      {
                        "type": "null"
                      }
                    ],
                    "x-owner": "paper executor 8470"
                  },
                  "realisedNet": {
                    "anyOf": [
                      {
                        "$ref": "urn:joedesk:common:v2#/$defs/money"
                      },
                      {
                        "type": "null"
                      }
                    ],
                    "x-owner": "paper executor 8470"
                  },
                  "fees": {
                    "anyOf": [
                      {
                        "$ref": "urn:joedesk:common:v2#/$defs/money"
                      },
                      {
                        "type": "null"
                      }
                    ],
                    "x-owner": "paper executor 8470"
                  },
                  "trades": {
                    "type": "integer",
                    "minimum": 0,
                    "maximum": 1000000,
                    "x-owner": "paper executor 8470"
                  }
                },
                "x-owner": "paper executor 8470"
              },
              "joe": {
                "type": "object",
                "additionalProperties": false,
                "required": [
                  "equityClose",
                  "realisedNet",
                  "fees",
                  "trades"
                ],
                "properties": {
                  "equityClose": {
                    "anyOf": [
                      {
                        "$ref": "urn:joedesk:common:v2#/$defs/money"
                      },
                      {
                        "type": "null"
                      }
                    ],
                    "x-owner": "paper executor 8470"
                  },
                  "realisedNet": {
                    "anyOf": [
                      {
                        "$ref": "urn:joedesk:common:v2#/$defs/money"
                      },
                      {
                        "type": "null"
                      }
                    ],
                    "x-owner": "paper executor 8470"
                  },
                  "fees": {
                    "anyOf": [
                      {
                        "$ref": "urn:joedesk:common:v2#/$defs/money"
                      },
                      {
                        "type": "null"
                      }
                    ],
                    "x-owner": "paper executor 8470"
                  },
                  "trades": {
                    "type": "integer",
                    "minimum": 0,
                    "maximum": 1000000,
                    "x-owner": "paper executor 8470"
                  }
                },
                "x-owner": "paper executor 8470"
              },
              "joel": {
                "type": "object",
                "additionalProperties": false,
                "required": [
                  "equityClose",
                  "realisedNet",
                  "fees",
                  "trades"
                ],
                "properties": {
                  "equityClose": {
                    "anyOf": [
                      {
                        "$ref": "urn:joedesk:common:v2#/$defs/money"
                      },
                      {
                        "type": "null"
                      }
                    ],
                    "x-owner": "paper executor 8470"
                  },
                  "realisedNet": {
                    "anyOf": [
                      {
                        "$ref": "urn:joedesk:common:v2#/$defs/money"
                      },
                      {
                        "type": "null"
                      }
                    ],
                    "x-owner": "paper executor 8470"
                  },
                  "fees": {
                    "anyOf": [
                      {
                        "$ref": "urn:joedesk:common:v2#/$defs/money"
                      },
                      {
                        "type": "null"
                      }
                    ],
                    "x-owner": "paper executor 8470"
                  },
                  "trades": {
                    "type": "integer",
                    "minimum": 0,
                    "maximum": 1000000,
                    "x-owner": "paper executor 8470"
                  }
                },
                "x-owner": "paper executor 8470"
              }
            },
            "x-owner": "paper executor 8470"
          }
        }
      },
      "maxItems": 40000,
      "x-owner": "paper executor 8470"
    },
    "trades": {
      "type": "array",
      "items": {
        "type": "object",
        "additionalProperties": false,
        "required": [
          "id",
          "desk",
          "symbol",
          "side",
          "quantity",
          "openedAt",
          "closedAt",
          "entryPrice",
          "exitPrice",
          "grossEur",
          "feesEur",
          "netEur",
          "fx",
          "method"
        ],
        "properties": {
          "id": {
            "type": "string",
            "minLength": 1,
            "maxLength": 48,
            "pattern": "^rt-[a-z0-9-]+$",
            "x-owner": "paper executor 8470"
          },
          "desk": {
            "enum": [
              "j",
              "joe",
              "joel"
            ],
            "x-owner": "paper executor 8470"
          },
          "symbol": {
            "type": "string",
            "minLength": 1,
            "maxLength": 16,
            "pattern": "^[A-Z0-9][A-Z0-9._-]{0,15}$",
            "x-owner": "paper executor 8470"
          },
          "company": {
            "type": "string",
            "minLength": 1,
            "maxLength": 100,
            "x-owner": "paper executor 8470"
          },
          "side": {
            "enum": [
              "long",
              "short"
            ],
            "x-owner": "paper executor 8470"
          },
          "quantity": {
            "$ref": "urn:joedesk:common:v2#/$defs/decimal",
            "x-owner": "paper executor 8470"
          },
          "openedAt": {
            "$ref": "urn:joedesk:common:v2#/$defs/instant",
            "x-owner": "paper executor 8470"
          },
          "closedAt": {
            "$ref": "urn:joedesk:common:v2#/$defs/instant",
            "x-owner": "paper executor 8470"
          },
          "entryPrice": {
            "$ref": "urn:joedesk:common:v2#/$defs/money",
            "x-owner": "paper executor 8470"
          },
          "exitPrice": {
            "$ref": "urn:joedesk:common:v2#/$defs/money",
            "x-owner": "paper executor 8470"
          },
          "grossEur": {
            "$ref": "urn:joedesk:common:v2#/$defs/money",
            "x-owner": "paper executor 8470"
          },
          "feesEur": {
            "$ref": "urn:joedesk:common:v2#/$defs/money",
            "x-owner": "paper executor 8470"
          },
          "netEur": {
            "$ref": "urn:joedesk:common:v2#/$defs/money",
            "x-owner": "paper executor 8470"
          },
          "fx": {
            "type": "object",
            "additionalProperties": false,
            "required": [
              "base",
              "quote",
              "rate",
              "source",
              "observedAt"
            ],
            "properties": {
              "base": {
                "type": "string",
                "minLength": 1,
                "maxLength": 3,
                "pattern": "^[A-Z]{3}$",
                "x-owner": "paper executor 8470"
              },
              "quote": {
                "const": "EUR",
                "x-owner": "paper executor 8470"
              },
              "rate": {
                "type": "string",
                "minLength": 1,
                "maxLength": 32,
                "pattern": "^(?:0\\.[0-9]{1,8}|[1-9][0-9]*(?:\\.[0-9]{1,8})?)$",
                "x-owner": "paper executor 8470"
              },
              "source": {
                "type": "string",
                "minLength": 1,
                "maxLength": 80,
                "x-owner": "paper executor 8470"
              },
              "observedAt": {
                "$ref": "urn:joedesk:common:v2#/$defs/instant",
                "x-owner": "paper executor 8470"
              }
            },
            "x-owner": "paper executor 8470"
          },
          "method": {
            "const": "execution-fifo-net-current-fx",
            "x-owner": "paper executor 8470"
          }
        }
      },
      "maxItems": 100000,
      "x-owner": "paper executor 8470"
    },
    "benchmark": {
      "type": "null",
      "x-owner": "paper executor 8470"
    },
    "reason": {
      "$ref": "urn:joedesk:reason:v2",
      "x-owner": "paper executor 8470"
    }
  },
  "x-owner": "paper executor 8470"
}
