{
  "schema": "inspr.joe.household.results.v2",
  "seq": 8,
  "generatedAt": "2026-10-14T17:42:22.000Z",
  "receivedAt": "2026-10-14T17:42:22.000Z",
  "currency": "EUR",
  "timeZone": "Europe/Vienna",
  "trackingStart": "2026-09-10",
  "days": [
    {
      "date": "2026-10-14",
      "desks": {
        "j": {
          "equityClose": {
            "amount": "4999",
            "currency": "EUR"
          },
          "realisedNet": {
            "amount": "-2",
            "currency": "EUR"
          },
          "fees": {
            "amount": "1.28",
            "currency": "EUR"
          },
          "trades": 2
        },
        "joe": {
          "equityClose": {
            "amount": "5000",
            "currency": "EUR"
          },
          "realisedNet": {
            "amount": "0",
            "currency": "EUR"
          },
          "fees": {
            "amount": "0",
            "currency": "EUR"
          },
          "trades": 0
        },
        "joel": {
          "equityClose": {
            "amount": "5000",
            "currency": "EUR"
          },
          "realisedNet": {
            "amount": "0",
            "currency": "EUR"
          },
          "fees": {
            "amount": "0",
            "currency": "EUR"
          },
          "trades": 0
        }
      },
      "coverage": "partial"
    },
    {
      "date": "2026-10-15",
      "desks": {
        "j": {
          "equityClose": {
            "amount": "4999",
            "currency": "EUR"
          },
          "realisedNet": {
            "amount": "0",
            "currency": "EUR"
          },
          "fees": {
            "amount": "0",
            "currency": "EUR"
          },
          "trades": 0
        },
        "joe": {
          "equityClose": {
            "amount": "5000",
            "currency": "EUR"
          },
          "realisedNet": {
            "amount": "0",
            "currency": "EUR"
          },
          "fees": {
            "amount": "0",
            "currency": "EUR"
          },
          "trades": 0
        },
        "joel": {
          "equityClose": {
            "amount": "5000",
            "currency": "EUR"
          },
          "realisedNet": {
            "amount": "0",
            "currency": "EUR"
          },
          "fees": {
            "amount": "0",
            "currency": "EUR"
          },
          "trades": 0
        }
      }
    }
  ],
  "trades": [
    {
      "id": "rt-synthetic-001",
      "desk": "j",
      "symbol": "DEMO",
      "side": "long",
      "quantity": "2",
      "openedAt": "2026-10-14T15:00:00.000Z",
      "closedAt": "2026-10-14T17:39:00.000Z",
      "entryPrice": {
        "amount": "20",
        "currency": "USD"
      },
      "exitPrice": {
        "amount": "19.8",
        "currency": "USD"
      },
      "grossEur": {
        "amount": "-0.36",
        "currency": "EUR"
      },
      "feesEur": {
        "amount": "0.64",
        "currency": "EUR"
      },
      "netEur": {
        "amount": "-1",
        "currency": "EUR"
      },
      "fx": {
        "base": "USD",
        "quote": "EUR",
        "rate": "0.9",
        "source": "synthetic-close-rate",
        "observedAt": "2026-10-14T17:39:00.000Z"
      },
      "method": "execution-fifo-net-current-fx"
    }
  ],
  "benchmark": null
}
